Invesco International Small-Mid Company Fund Class R6 (OSCIX),OSCIX,MF,Foreign Small-Mid Growth,3.0,4.0,5.0,4.0,34.52,13.43,14.26,NA,NA,NA,23.23,45.45,0.54,15.4,-0.06,38.54,-9.09,25.28,25.23,12.1,0.95,0.95,18.6,15.56,14.42,0.66,0.98,0.94,0.65,0.85,98.5,NA,NA,NA
Grandeur Peak International Stalwarts Fund Institutional Class (GISYX),GISYX,MF,Foreign Small-Mid Growth,5.0,5.0,N/A,5.0,47.86,21.22,NA,NA,NA,NA,NA,NA,NA,NA,5.22,36.85,-17.4,31.92,38.49,20.04,0.92,0.92,21.74,17.67,NA,0.89,1.03,NA,1.09,13.71,85.2,NA,NA,NA
T. Rowe Price International Discovery Fund I Class (TIDDX),TIDDX,MF,Foreign Small-Mid Growth,4.0,4.0,4.0,4.0,39.2,15.8,NA,NA,NA,NA,NA,NA,NA,NA,1.08,39.16,-17.34,24.78,38.9,11.27,1.06,1.06,20.0,16.34,15.05,0.77,1.03,0.79,1.97,0.17,97.61,NA,NA,0.25
Artisan International Small-Mid Fund Institutional Share (APHJX),APHJX,MF,Foreign Small-Mid Growth,4.0,3.0,3.0,3.0,33.59,15.73,NA,NA,NA,NA,NA,NA,NA,NA,NA,33.61,-16.75,36.66,33.31,6.09,1.1,1.1,19.67,16.79,16.53,0.84,0.87,0.62,1.56,21.28,77.16,NA,NA,NA
Royce International Premier Fund Institutional Class (RIPIX),RIPIX,MF,Foreign Small-Mid Growth,3.0,3.0,3.0,3.0,31.09,14.91,NA,NA,NA,NA,NA,NA,NA,NA,NA,NA,NA,34.68,16.12,9.64,1.04,1.2,18.9,15.8,15.19,0.75,0.89,0.64,3.69,1.28,95.03,NA,NA,NA
Calvert International Opportunities Fund Class I (COIIX),COIIX,MF,Foreign Small-Mid Growth,3.0,3.0,3.0,3.0,35.02,10.49,10.74,9.95,13.19,-17.55,25.53,28.16,-4.21,2.29,0.95,38.51,-14.58,26.1,14.04,12.36,1.07,1.07,19.55,16.07,15.54,0.5,0.84,0.6,1.49,0.01,98.34,0.16,NA,NA
MFS International New Discovery Fund Class R6 (MIDLX),MIDLX,MF,Foreign Small-Mid Growth,2.0,2.0,3.0,2.0,24.54,7.93,8.93,NA,NA,NA,NA,19.91,-2.55,2.85,0.65,32.16,-10.29,22.94,10.14,6.3,0.92,0.92,17.24,14.24,13.67,0.47,0.73,0.6,2.56,0.43,97.0,NA,NA,NA
