PIMCO Total Return ESG Fund Institutional Class (PTSAX),PTSAX,MF,Intermediate Core-Plus Bond,3.0,3.0,3.0,3.0,1.16,6.25,3.86,3.55,9.08,3.53,9.69,-2.07,4.54,0.41,2.96,4.46,-0.78,8.94,8.97,0.06,0.96,0.96,3.82,3.5,3.5,1.22,0.77,0.84,4.29,NA,NA,64.17,28.39,3.15
PIMCO Low Duration Fund Institutional Class (PTLDX),PTLDX,MF,Short-Term Bond,2.0,3.0,3.0,3.0,1.03,2.86,1.99,1.9,4.96,1.71,6.16,0.1,0.78,0.67,1.91,1.84,0.51,4.47,3.41,0.15,0.87,0.87,1.53,1.31,1.64,1.13,0.79,0.8,-41.77,NA,NA,97.01,25.72,19.04
MFS Global High Yield Fund Class R6 (MHOVX),MHOVX,MF,High Yield Bond,3.0,3.0,3.0,3.0,8.27,6.12,5.36,5.53,16.52,3.46,15.31,6.05,2.67,-3.7,13.32,7.47,-2.76,14.4,4.23,2.82,0.74,0.82,8.62,6.93,6.68,0.63,0.75,0.76,3.77,NA,0.25,52.37,41.12,2.48
PIMCO Total Return Fund IV Institutional Class (PTUIX),PTUIX,MF,Intermediate Core Bond,4.0,4.0,4.0,4.0,1.29,5.99,3.85,3.9,NA,NA,9.3,-1.84,4.16,-0.14,3.06,4.57,-0.77,9.66,7.33,0.17,0.8,0.8,3.98,3.56,3.43,1.1,0.71,0.98,-2.27,NA,NA,89.83,10.74,1.7
PIMCO Income Fund Institutional Class (PIMIX),PIMIX,MF,Multisector Bond,3.0,5.0,5.0,5.0,8.31,5.54,5.47,6.91,20.46,6.36,22.17,4.8,7.18,2.63,8.72,8.6,0.58,8.05,5.8,2.14,1.09,1.09,5.75,4.56,4.2,0.77,1.01,1.48,11.42,0.75,2.75,61.94,17.99,5.15
PIMCO Investment Grade Credit Bond Fund Institutional Class (PIGIX),PIGIX,MF,Corporate Bond,2.0,3.0,5.0,4.0,2.69,7.33,5.49,5.66,11.72,6.86,14.99,-1.69,8.76,0.28,6.99,7.95,-2.02,14.72,7.5,0.24,0.85,0.85,7.5,6.2,5.49,0.8,0.66,0.93,-51.29,0.05,0.22,120.01,24.86,6.15
